title,description,full_text,url,source_name,source_url,image_url,published_date,search_query,firm_name,keyword_used,collection_date
How does Ferrero’s Bold Snacks acquisition in Brazil signal wider industry trends? - Food Ingredients First,How does Ferrero’s Bold Snacks acquisition in Brazil signal wider industry trends?  Food Ingredients First,How does Ferrero’s Bold Snacks acquisition in Brazil signal wider industry trends?  Food Ingredients First,https://news.google.com/rss/articles/CBMikAFBVV95cUxQWThVNndta0JXZlBLTXkxcWlIMUgxVzRFVWJPS1RBQWJlZXZWNHhVaDNMU2pLY2xkNERPR0tzOThMVlFuMUwydngyVFZJY3hkeUduTFpkYWRHd2FocDM1eDRkWU02Nm1KVWFBTmNQZHk3Y0ZKQmhlRXgtNUVWcEVkTGR4aW9DTHBlUUpaVlgyRmk?oc=5&hl=en-US&gl=US&ceid=US:en,,,,2026-04-09 20:28:52.329894,"""Ferrero"" ""GLP-1""",Ferrero,GLP-1,2026-04-09 20:28:52.329899
Ferrero solidifying its US position with WK Kellogg acquisition - Food Business News,Ferrero solidifying its US position with WK Kellogg acquisition  Food Business News,Ferrero solidifying its US position with WK Kellogg acquisition  Food Business News,https://news.google.com/rss/articles/CBMisAFBVV95cUxNRk9QRzYyZ0M4bjIxTjRNeFJfbGFueUFSY2pJRGFhbHZWYXdXS2J2M205Qi1HYVRKeVZYRGt6S1czc0tobWJ2ZXA2N0ZuTkRIV3lNQW1YenRoR0pIcXNQVlZNWG5aQ2trT1dveXpxbzFFWFVXTnl1R1daZnBWNHJ2aHBZYTQwT1ZMbXlTYkNLcGt5UnptVE5XNEd6Uk91SnRCclhGRUUzcnhFdTFGZjlVTg?oc=5&hl=en-US&gl=US&ceid=US:en,,,,2026-04-09 20:28:52.329967,"""Ferrero"" ""GLP-1""",Ferrero,GLP-1,2026-04-09 20:28:52.329968
Billionaire Ferrero Clan Joins Rival Mars in Looking Beyond Chocolate - Bloomberg.com,Billionaire Ferrero Clan Joins Rival Mars in Looking Beyond Chocolate  Bloomberg.com,Billionaire Ferrero Clan Joins Rival Mars in Looking Beyond Chocolate  Bloomberg.com,https://news.google.com/rss/articles/CBMiswFBVV95cUxQaEpWZ2ZtZy1sOV9QZGtHYkVFRWJEWXk3UTVZbk9IZnRQQWNLSDVuMDZITS1BNEY1dkVsVUtMTTRnRy1mcUdCZDZhUGQ0Nm9RZVJhU0FzN08waWp4S29mSmlqV3VzamhXamZIbk50UXZrTFo2R3NNQnRmR3k4UXVoSFNQOFVuV2p5NXhQaF9tWHhCclNueThnN3lyZ3lXNmJJQzJSRnk3YWY0cFlWSHdUWnJEYw?oc=5&hl=en-US&gl=US&ceid=US:en,,,,2026-04-09 20:28:52.329990,"""Ferrero"" ""GLP-1""",Ferrero,GLP-1,2026-04-09 20:28:52.329991
What’s Behind the Endless Breakup-Merger Cycle? - Knowledge at Wharton,What’s Behind the Endless Breakup-Merger Cycle?  Knowledge at Wharton,What’s Behind the Endless Breakup-Merger Cycle?  Knowledge at Wharton,https://news.google.com/rss/articles/CBMilAFBVV95cUxOY21FeTJxa19uMUtKVDRMWFBFRHhoYzh2X0FqRHNPUElDZ19TQlNEc05aekZRQlJveFU3b3VGSVJEVzVockNJeXlSYVVXcjM1NXExeWhPRUptNkREbE5KVTdZSzEzUnItOUJtYTlJdmcwR1g1d1VPQ1o5ZFhkbmw4WHZrZ3Z1RWpvWjBkeU11U1dZcXBM?oc=5&hl=en-US&gl=US&ceid=US:en,,,,2026-04-09 20:28:52.329998,"""Ferrero"" ""GLP-1""",Ferrero,GLP-1,2026-04-09 20:28:52.329999
Ferrero to Acquire Kellogg in $3.1B Deal - Convenience Store News,Ferrero to Acquire Kellogg in $3.1B Deal  Convenience Store News,Ferrero to Acquire Kellogg in $3.1B Deal  Convenience Store News,https://news.google.com/rss/articles/CBMiYEFVX3lxTFBWOEFjZjV6Z0V4ajNQa1A1Tl9nRmhveTB4OU1yUHl0cGRTb1FDTkJGb2xNUVlXOW5Oakp6MnJzUGZDaUx4TGtkWHE1eWZsMC1Gc01LSjdXTWFnNHVIaUpQcg?oc=5&hl=en-US&gl=US&ceid=US:en,,,,2026-04-09 20:28:52.330006,"""Ferrero"" ""GLP-1""",Ferrero,GLP-1,2026-04-09 20:28:52.330007
"First Mars, now Ferrero: Why confectioners are betting big on snacks - FoodNavigator.com","First Mars, now Ferrero: Why confectioners are betting big on snacks  FoodNavigator.com","First Mars, now Ferrero: Why confectioners are betting big on snacks  FoodNavigator.com",https://news.google.com/rss/articles/CBMinAFBVV95cUxOYUF5NFNCaXdEZzA1RXpzX0szRVhPeHZkY0VEdUMyUGFlMGhFSVJUUEZkc0pSZ0JtX0hhUldQWlBnbkZWSzNhczRRX1dSMU9GSmxzcDhoOEdOazg2MjdRTTI2d2FyV3pBaVptMTYxQVZfTUE2S0ZOUHc1akN6Q1l5MzFndmhHNFFwYWVnVWYxNmk3UDc5U0dlRG1mRGQ?oc=5&hl=en-US&gl=US&ceid=US:en,,,,2026-04-09 20:28:52.330016,"""Ferrero"" ""GLP-1""",Ferrero,GLP-1,2026-04-09 20:28:52.330017
"With 60,000+ members, SheMed raises €43 million to advance personalised women’s healthcare in the UK - EU-Startups","With 60,000+ members, SheMed raises €43 million to advance personalised women’s healthcare in the UK  EU-Startups","With 60,000+ members, SheMed raises €43 million to advance personalised women’s healthcare in the UK  EU-Startups",https://news.google.com/rss/articles/CBMizgFBVV95cUxPQmxBdUlWcTNJSmVCRHBjZHJXbnRvVDVqdDhUS0FnQVBmcjZieE03MkQ3YmRLbmRZOHlCbHNFeHNQN193YzloeE9uUGdYck1fVGl1cDRkY0x4Q2JhNVdQdHJxWTg1X2NLdUV1SHZzVGNPQk1IY0NiME1IRy1CbkNRQVhQTkZONzNfWnpDeEFCTl9jUnIzTUtON1VTMzQzd2xfUTdONGJ5cHJiRy1mU1YzdzJFTGYwRktyNHFydEJJalJOVTQ1SGpLa3RIYWltUQ?oc=5&hl=en-US&gl=US&ceid=US:en,,,,2026-04-09 20:28:52.330029,"""Ferrero"" ""GLP-1""",Ferrero,GLP-1,2026-04-09 20:28:52.330030
Gilded Springtime Easter Treats : Ferrero Rocher Easter - Trend Hunter,Gilded Springtime Easter Treats : Ferrero Rocher Easter  Trend Hunter,Gilded Springtime Easter Treats : Ferrero Rocher Easter  Trend Hunter,https://news.google.com/rss/articles/CBMiZ0FVX3lxTE53T3NGZzVELU1uemZIWXh6ejYxWTk2TXEyOEpqVkhQVUhhcjBOa043T0J6TzJaclpQMUREekhubWl6NERfOF9FTFN3aVZHcDl2ckdGT1d3R3pHWW5FNHk4ZFBrMElDYmM?oc=5&hl=en-US&gl=US&ceid=US:en,,,,2026-04-09 20:28:52.330037,"""Ferrero"" ""GLP-1""",Ferrero,GLP-1,2026-04-09 20:28:52.330038
Why fixing Kraft Heinz will test its new CEO more than splitting Kellogg did - Ad Age,Why fixing Kraft Heinz will test its new CEO more than splitting Kellogg did  Ad Age,Why fixing Kraft Heinz will test its new CEO more than splitting Kellogg did  Ad Age,https://news.google.com/rss/articles/CBMinwFBVV95cUxQb3UtQ1RhN1NWRkczM0MyRjhKQXQwai0weVFHQldrcDBMM1lvbk0wUWRwVWoxWlBobjRXRVN1VDRfcEFJbldEV3psRi04VkdyNWg5a0Q1YWRrMl9EcmpRM0t3VndBYl9lQldQR25YN2ZSSFVjbDFuQVdiMWM5Q2UzdW9oajN4VHlmakNNUmF1VWtYU09lN2NvOUJkcXZDUGc?oc=5&hl=en-US&gl=US&ceid=US:en,,,,2026-04-09 20:28:52.330044,"""Ferrero"" ""GLP-1""",Ferrero,GLP-1,2026-04-09 20:28:52.330045
Ferrero Agrees To Deal For Brazilian Protein Snack Company Bold Snacks - checkout.ie,Ferrero Agrees To Deal For Brazilian Protein Snack Company Bold Snacks  checkout.ie,Ferrero Agrees To Deal For Brazilian Protein Snack Company Bold Snacks  checkout.ie,https://news.google.com/rss/articles/CBMirwFBVV95cUxOcS01LW9wYWxCNVVHODktUVd0ZXhPV29XV29BRkJBZ3hVY2dRY3dBTHpIeHVObEJzSUtsSzlNWWlHZ0EycEN4dzQxZXp1OG5ubkxsZVlSeWhBU3QyWm5mYXFPOXhLbmQ0aUFmU3ZTVTl3LXRXcGpWRzB1QlZSc2VqQXcxRlp0ckI3Q0tra2lOWXpJSFJMdno5aWtCOFVBakdCTGw3cTBVY0FMcTRRUVpn?oc=5&hl=en-US&gl=US&ceid=US:en,,,,2026-04-09 20:28:52.330052,"""Ferrero"" ""GLP-1""",Ferrero,GLP-1,2026-04-09 20:28:52.330053
Nestle to launch Vital Pursuit frozen-food brand targeting GLP-1 users - CNBC,Nestle to launch Vital Pursuit frozen-food brand targeting GLP-1 users  CNBC,Nestle to launch Vital Pursuit frozen-food brand targeting GLP-1 users  CNBC,https://news.google.com/rss/articles/CBMimwFBVV95cUxQMlRPWHpYbjd6QWtMUVAtbC0taXQ0UlFfMENxVTJibGxPQ1BCQ1J5RUprOE5YN1EzZXhqVHVfQml2cnRUd2k1dlZYOHNmSE5Eek5lOG41X1dPdFYzaldnRFBxbC0yZVFhb0h6YVFJdTN4Z3RFSGZnYW5TV25rc0d3T1UwOXY1eDRESHZnMjI3cmh5NHdGS0tFa0VwVdIBoAFBVV95cUxQbkc1bFhoNmJvSVV4N2JiZk4xOGVCbk1GNDBTTTZ6QUdMS3QxVE4zeVZOMEY1LTEzS2JLdGFvUnFpV25kb1NWNnpmaDBvWFJhREdVV1Z6eWwtRm1KS1gwUjdmQTVrdlJmcjBHMnNmN0JfUlpQQ1A2VFhldmFCeUhOVVlrSUloX2d5QU1wRHAxREtsLURLUTFxMi13eFNKbk90?oc=5&hl=en-US&gl=US&ceid=US:en,,,,2026-04-09 20:28:52.330060,"""Ferrero"" ""GLP-1""",Ferrero,GLP-1,2026-04-09 20:28:52.330061
Kraft Heinz breakup ends a decade of merger misery - Mass Market Retailers,Kraft Heinz breakup ends a decade of merger misery  Mass Market Retailers,Kraft Heinz breakup ends a decade of merger misery  Mass Market Retailers,https://news.google.com/rss/articles/CBMiiwFBVV95cUxPSHVVV3pHZy1peUxLSGhmVHNXSWpWd0RsMExQRVN0TjFXUnpYSXZZa2FmQ1lZMUNsUFFfMTVrTmI0bTIzU0ZiVkxQZUNOY19WSEtpZHlMN2hEbEtrYnYwUEVYVFJCV0cyMV9xUUM3aDBiWUZUWGVLYjhfZG96UTNrRVhJdU40dlV6YTBV?oc=5&hl=en-US&gl=US&ceid=US:en,,,,2026-04-09 20:28:52.330067,"""Ferrero"" ""GLP-1""",Ferrero,GLP-1,2026-04-09 20:28:52.330068
Snack-Friendly Chocolate Squares - Trend Hunter,Snack-Friendly Chocolate Squares  Trend Hunter,Snack-Friendly Chocolate Squares  Trend Hunter,https://news.google.com/rss/articles/CBMidkFVX3lxTE9ZY19FazVmanRDRnV4T0FfREhKY2NaY0Q3T2NjZ2t3aFV2RjJfX1BDX0RBM0tiaURlSVZmaVFJRTBKblRuSEJMRWRwbEcxUEJUdzJnS2ZVcFAxNHVLbGdYM0t3OFVUMmZTRXlZbWRoajZTRkQ2b2fSAXtBVV95cUxPNVVhSEtTSnc5bEEyRWVxYTFWWXpaT3lqbnRrYWcxYmNxQzR3LWZLY2RpS1ZSVE9EbG03VzBkWDltZnpNM0hGdTFMcHhORUE0OHFoWEJGSWttRUJUUFI3aDQyT3l0MTE3TzhBOFFzekw3cnN1dDctY0g2Q3M?oc=5&hl=en-US&gl=US&ceid=US:en,,,,2026-04-09 20:28:52.330075,"""Ferrero"" ""GLP-1""",Ferrero,GLP-1,2026-04-09 20:28:52.330077
Ferrero removes group CEO role in management rejig - Global Food Industry News,Ferrero removes group CEO role in management rejig  Global Food Industry News,Ferrero removes group CEO role in management rejig  Global Food Industry News,https://news.google.com/rss/articles/CBMid0FVX3lxTFBGZ05RUW5URmRoOVhaU2xuXzZsUTZsVzR0Y1JSdkhJbEFBeWxDZzdHNFJDNUdnM0FCd0R3eXVBZE0zQmJjc0RqUnVadDY5T1p2dFY5RzNfbDdDX09xNTFkWkxvZ1Z0YjRFYklfcWx4MmtvU3lDdXNB?oc=5&hl=en-US&gl=US&ceid=US:en,,,,2026-04-09 20:28:52.330083,"""Ferrero"" ""GLP-1""",Ferrero,GLP-1,2026-04-09 20:28:52.330084
"General Mills, WK Kellogg & Ferrero spark a fresh fight for the breakfast bowl - BakeryAndSnacks.com","General Mills, WK Kellogg & Ferrero spark a fresh fight for the breakfast bowl  BakeryAndSnacks.com","General Mills, WK Kellogg & Ferrero spark a fresh fight for the breakfast bowl  BakeryAndSnacks.com",https://news.google.com/rss/articles/CBMiqAFBVV95cUxOQ3FOZF9ld3IwZHFzclpJZzJpSlpYdlVST3FYc2FuYS0yaTM3ZkZvcUh3Y3hlRWpZeGhPS1JobVRYUmwteGpCUmhsNC1uY1I0cmtvMXhoTjVQaS1FdnRCSGdUNFZ6WVFvbW5IaGgzTFBnWGVhZHhUOEItd0NFUE9yMGVJS0hLZkxnZVVlQS1jeWp6UlRpWWFIVlFhbnQtMklFQnFmSXlKeUc?oc=5&hl=en-US&gl=US&ceid=US:en,,,,2026-04-09 20:28:52.330091,"""Ferrero"" ""GLP-1""",Ferrero,GLP-1,2026-04-09 20:28:52.330092
New Report Highlights The Sweet Side Of Ultra-Processed Foods - Forbes,New Report Highlights The Sweet Side Of Ultra-Processed Foods  Forbes,New Report Highlights The Sweet Side Of Ultra-Processed Foods  Forbes,https://news.google.com/rss/articles/CBMitgFBVV95cUxOclpNZUlqZHFEMG9SWGE3Y3BrYjdxSVU5TzZwOXlSbzlyZ3hUakRIVk9ybVRrUXFGRmh5TjhJVmdjTTFPUVoxb3M2aUVmYXo5WnY1UVlnOGhJTlBXUldIeXlkcHhzMERNVWJQYVNHUngzamg1aFhFMDA0Y3NmcUxkV0tFT3NoYzB1UFFOSjY3WXNrVlM5b2o4cUJWMjNzOUo4WUlnNnh6bXFWcEdyOVptMVE3bG9yQQ?oc=5&hl=en-US&gl=US&ceid=US:en,,,,2026-04-09 20:28:52.330098,"""Ferrero"" ""GLP-1""",Ferrero,GLP-1,2026-04-09 20:28:52.330099
Comprehensive Brand Platforms - Trend Hunter,Comprehensive Brand Platforms  Trend Hunter,Comprehensive Brand Platforms  Trend Hunter,https://news.google.com/rss/articles/CBMiXkFVX3lxTE9Jb0F6bTBGcWl1SjZsbnlPWWFibHRpdmlGamVSWEludTB5S1hJd2JhVkJrOU1wRWdZVjk5NWJVTTZGT0t3VEtfVTJMcmxiVmhseXprLThybkFQSTJETmfSAWNBVV95cUxOVTZGbGhUYy0ySnpJbkFwY2pVRFdLOURJeVd4QVEtd2JaYTZTOExZeVl1YUItek1ReVNYOUNxbW1CajlFZi1fanAzbXN5bWhveTRlYmNuSkRHMlVIQ1U3VTBtLWc?oc=5&hl=en-US&gl=US&ceid=US:en,,,,2026-04-09 20:28:52.330105,"""Ferrero"" ""GLP-1""",Ferrero,GLP-1,2026-04-09 20:28:52.330106
Ferrero Group bolsters its “better-for-you” position with Power Crunch acquisition - Food Ingredients First,Ferrero Group bolsters its “better-for-you” position with Power Crunch acquisition  Food Ingredients First,Ferrero Group bolsters its “better-for-you” position with Power Crunch acquisition  Food Ingredients First,https://news.google.com/rss/articles/CBMixgFBVV95cUxNTGtwTEVfTzFiTXp1X1RDdjJGSndnZm1SdG9jN21ZN2UxSVNacktoMUs4UjNoZFB2dUVzSkJaeUhBUVRMcWQ0ZjdkUGk5dXZPM3BMdm5IbWdnanlwVGVGMy1MZnV0eXkzZDZ5V01jaEhNZFpjOTI5bnJHTG91d0F2OFhVZEhnbGllZ0d1c0UtYlctdUxVdGJhSXVOU1RQNHZITEdPbUM0VjY3aTdfYm9OZ3pxS09aU1ZIRzZZUkhTWHZTaUZZblE?oc=5&hl=en-US&gl=US&ceid=US:en,,,,2026-04-09 20:28:52.330113,"""Ferrero"" ""GLP-1""",Ferrero,GLP-1,2026-04-09 20:28:52.330114
Ferrero shakes up production at Spain ice-cream plant - Global Food Industry News,Ferrero shakes up production at Spain ice-cream plant  Global Food Industry News,Ferrero shakes up production at Spain ice-cream plant  Global Food Industry News,https://news.google.com/rss/articles/CBMibkFVX3lxTFBhQUhZQ1VPLVZmc3VhVVRrVHQ3UUI0VGdGSnl0UU5oNXYyMDlHV1dPYU9PMTk0OWtrOERvYlNxQlh0N1FDcHdqN0JrWU03ZGtPU05NRFNuUnFWTGlRV1EycGlnd1BLeDVHa0Q1aFN3?oc=5&hl=en-US&gl=US&ceid=US:en,,,,2026-04-09 20:28:52.330121,"""Ferrero"" ""GLP-1""",Ferrero,GLP-1,2026-04-09 20:28:52.330123
Ferrero to invest in Canada facility expansion - Global Food Industry News,Ferrero to invest in Canada facility expansion  Global Food Industry News,Ferrero to invest in Canada facility expansion  Global Food Industry News,https://news.google.com/rss/articles/CBMicEFVX3lxTE16cWZRRzFwRnpzWTZ4bWRubExDRzBqRDhveGV1SHZZNmFCajVyNEE3eW1LWjhGNWc4ZHpqWnRXZWhMNktxMDdSYzU2VU1zNGMwNWgzc21lYTJKTnlISEV3T2pnZkd0MWlfVHAwRnI2Zkg?oc=5&hl=en-US&gl=US&ceid=US:en,,,,2026-04-09 20:28:52.330131,"""Ferrero"" ""GLP-1""",Ferrero,GLP-1,2026-04-09 20:28:52.330132
Holiday treats and meals still a priority despite inflation worries - FoodNavigator-USA.com,Holiday treats and meals still a priority despite inflation worries  FoodNavigator-USA.com,Holiday treats and meals still a priority despite inflation worries  FoodNavigator-USA.com,https://news.google.com/rss/articles/CBMi9wFBVV95cUxNUU5hNzR5S0pPQlQyejU2bnZtMUhlM214MkVCTHVReVdDRTc5VmNmaXJYRnFDbGxVSjVGcjQzNmk2cWtlUF9mNmtaaTZyMzZ0dG1kRXBhSUtSYVZjM1YzZmZhYTc3UkpzYzhoU0VZemRjTWdkOFl6bXU2MmRZUlNEdVNnTGgxZHZVdlYtblpBSWgzaXJZQ0NzTVlUbDhVZUh6TzkxbUtJa2RzRmhOWDQtTFE1Ulh6dGs4WGFXZGRKVng1Uy1lcEdNNG5PQmJOUzF1V0h0M2ZNX3o0RjNCOGR0M2RuZTZkcjZCZklhd2FreGQ3SDN0R3Nz?oc=5&hl=en-US&gl=US&ceid=US:en,,,,2026-04-09 20:28:52.330138,"""Ferrero"" ""GLP-1""",Ferrero,GLP-1,2026-04-09 20:28:52.330139
Ferrero adds to Brazil assets with Bold Snacks buy - Global Food Industry News,Ferrero adds to Brazil assets with Bold Snacks buy  Global Food Industry News,Ferrero adds to Brazil assets with Bold Snacks buy  Global Food Industry News,https://news.google.com/rss/articles/CBMiigFBVV95cUxQQllHZXUwRTF0QXR3Um5FWU0wbnhRUDBOZ19wVDRjNFd1eU5CY1Nac3RlVVFDSWJPQl9xSTBfbDluNzVGaE04N1gzOGJfYVpPRzZIenJyd2hjakktUkRsTmhIOERvNHNXVkM4M2p2bTV6S1ZLX2x3WURfN0pKOXpoNFVDbUlVU2dERVE?oc=5&hl=en-US&gl=US&ceid=US:en,,,,2026-04-09 20:28:52.330145,"""Ferrero"" ""GLP-1""",Ferrero,GLP-1,2026-04-09 20:28:52.330146
Ferrero Group snaps up protein snack maker Power Crunch - Global Food Industry News,Ferrero Group snaps up protein snack maker Power Crunch  Global Food Industry News,Ferrero Group snaps up protein snack maker Power Crunch  Global Food Industry News,https://news.google.com/rss/articles/CBMiaEFVX3lxTFBnY09aSVc4bjZxbkpHNTZFa21FSVRncEQ1eHFqUVpGU0NvMEFfSU41WUt2SVM3ZEhOMy1hemRILUF3S3hVUlBPek9IbzdpTTB2QW1PUnFoMUlQRmR2enMyNHdaWHh2b3Iz?oc=5&hl=en-US&gl=US&ceid=US:en,,,,2026-04-09 20:28:52.330152,"""Ferrero"" ""GLP-1""",Ferrero,GLP-1,2026-04-09 20:28:52.330154
Set to go: Two weeks of tennis mania Down Under ahead of the Australian Open - Greenwich Time,Set to go: Two weeks of tennis mania Down Under ahead of the Australian Open  Greenwich Time,Set to go: Two weeks of tennis mania Down Under ahead of the Australian Open  Greenwich Time,https://news.google.com/rss/articles/CBMipwFBVV95cUxOOEtJTFJMVEpTR3FNT1VhYnlBSE43QkpzX1B6VzZUS1FXdHVrQm1PU1hzUFFvZE5Ka1otZkNpQnl2TjB1STk4NUtRQ0FDYzBac1hxWGxLTUdabFR2N0ZscmxvYWRsMW9lN1pKSTJkN3I5TzhncXl3QXNVWUQ3UllNeW8wMmRKelZSSFBmeV8zZnVRYzlINEJBcU84YnUxQzM3cDlITVR5TQ?oc=5&hl=en-US&gl=US&ceid=US:en,,,,2026-04-09 20:28:52.330160,"""Ferrero"" ""GLP-1""",Ferrero,GLP-1,2026-04-09 20:28:52.330161
Ferrero dives for Italy frozen-pastry company Fresystem - Global Food Industry News,Ferrero dives for Italy frozen-pastry company Fresystem  Global Food Industry News,Ferrero dives for Italy frozen-pastry company Fresystem  Global Food Industry News,https://news.google.com/rss/articles/CBMikAFBVV95cUxOM1c0S3VkUF9HQXVzc19QZnozUF9OYVVEYk9nNjRteGF1a0RzOFlSWXcyU2Nhc3ZIblprRjB6cmY0WTV2RWlDR1JoNzhhSXUwZ0RsZ3I5dHNPbXB3OHdRalRwdkIwTW9DMXBFOEZLUi1VRmFlV05PeF9oZTJ3Wkpzdk54Yi1jT0lNb3NEcURJbWs?oc=5&hl=en-US&gl=US&ceid=US:en,,,,2026-04-09 20:28:52.330167,"""Ferrero"" ""GLP-1""",Ferrero,GLP-1,2026-04-09 20:28:52.330169
Ferrero confirms deal to buy WK Kellogg for $3.1bn - Global Food Industry News,Ferrero confirms deal to buy WK Kellogg for $3.1bn  Global Food Industry News,Ferrero confirms deal to buy WK Kellogg for $3.1bn  Global Food Industry News,https://news.google.com/rss/articles/CBMinAFBVV95cUxQTElKWVhXellNQnlNT2VSaFlENFpWRlJTbWNpTTExVTdURVUzWkFaTEp2dDQzRm50ZnZ0VG4xTGg2ZHJraXQ0ZTV6bzF1YlY1MW9vcHJtOVdJcnhqTGFmMVhlczZKQnVQNVViYW8xSlJmZU1YOGYzbGhxSTNhR0RydWJ0MW56cW1Ma2xGdmxyRUNBNWlEeGdhZklxejQ?oc=5&hl=en-US&gl=US&ceid=US:en,,,,2026-04-09 20:28:52.330175,"""Ferrero"" ""GLP-1""",Ferrero,GLP-1,2026-04-09 20:28:52.330176
Ferrero plans to build new production hall at German plant - Global Food Industry News,Ferrero plans to build new production hall at German plant  Global Food Industry News,Ferrero plans to build new production hall at German plant  Global Food Industry News,https://news.google.com/rss/articles/CBMilgFBVV95cUxOeWgtNGFRUXBZMkZ1amxIRDRpblF3V2h5Wkg2eXc1ci1tbE9EQ2xqRzUwWjItTy00MElOWG1TZWE1T3NOWllOcEExM3JzVmZMZVdONlhGcUhCWTE3VE0tRFBmWWhGQ3Q4Z3E0LWxQNEpmN2VJVjhqQ0VZX1FweVFjQlE4RHExYmhqYXRVUzNjbzFrem1wQkE?oc=5&hl=en-US&gl=US&ceid=US:en,,,,2026-04-09 20:28:52.330182,"""Ferrero"" ""GLP-1""",Ferrero,GLP-1,2026-04-09 20:28:52.330184
Ferrero’s US expansion continues: Nutella owner swoops for Kellogg’s cookie and fruit snacks brands in US$1.3bn deal - Food Ingredients First,Ferrero’s US expansion continues: Nutella owner swoops for Kellogg’s cookie and fruit snacks brands in US$1.3bn deal  Food Ingredients First,Ferrero’s US expansion continues: Nutella owner swoops for Kellogg’s cookie and fruit snacks brands in US$1.3bn deal  Food Ingredients First,https://news.google.com/rss/articles/CBMi7wFBVV95cUxQS0Zmd3FGZV9wN3RYMTBLb00xRDFIVlhlQ085QU5kVFk5VnhuZWFZbmVSemdfMXBJblI3RWVlQ0VJNENJZjg4N0xhQlMwVHYzSVVhbWVONXo2Z0RJS1JOWkEzaUtKRU9XNzJzUXNmNVRnZDFXaDJBU1dqb3lVTUI2c0VjR1F1THBXcEE0WVcxRjNHczFPMmhkczF4R0hqZTh5VTdmV1JON21IdHRzU0Z2X1BNVy0ySnI2U3BtTmR3WHFmWTcxU2l0TjZvY2RLa1dPcUtON1BQcUxBU1VVMnFoVExfd20wUi10dUYzZHZtbw?oc=5&hl=en-US&gl=US&ceid=US:en,,,,2026-04-09 20:28:52.330190,"""Ferrero"" ""GLP-1""",Ferrero,GLP-1,2026-04-09 20:28:52.330191
Is Nutella A Dessert Topping Or A Spread? The FDA Wants To Know : The Two-Way - NPR,Is Nutella A Dessert Topping Or A Spread? The FDA Wants To Know : The Two-Way  NPR,Is Nutella A Dessert Topping Or A Spread? The FDA Wants To Know : The Two-Way  NPR,https://news.google.com/rss/articles/CBMizAFBVV95cUxOVFk0bEpnSEpRRGhrSW1pTzNUVmt5NTlCZlE3eDZnTFhPMl91Y3pKZXUtUzlwSWgyMF9jVVNpX2l2azZmakNJNjktR3JEd2Y4YzV1bnZSX0N3VmRPQ0ZORjdLUW1hQWlkUElHVVZNbWJBTHloOWQ4a2RTM3Q2SmhkcGxvazI1aHFST1FjMkpNN2FzZG9vSTFjTHNlVHlXa3BEVS1xS1ZzcFFJam1CSW5yek12bS1UZ1gwaGN2SVdRWS1rNmRkd3hSYW13c0k?oc=5&hl=en-US&gl=US&ceid=US:en,,,,2026-04-09 20:28:52.330198,"""Ferrero"" ""GLP-1""",Ferrero,GLP-1,2026-04-09 20:28:52.330199
Ferrero stepping up investment in Indian confectionery - Global Food Industry News,Ferrero stepping up investment in Indian confectionery  Global Food Industry News,Ferrero stepping up investment in Indian confectionery  Global Food Industry News,https://news.google.com/rss/articles/CBMijwFBVV95cUxPZmJ2cVZBRS1wM21wRWJuMnVjUGlGalE4eWpZSDlNTWxhVFZtdktPZUZjdzJqVXNzZDdpd1o2UjRXaWY2alJ6eXUwU3R1eWxWTzQxZVJwQzBGMTBIVDVFQS1kZDYzZUplbUlsMmlKR2FVMmxLemJyWUR6d1lUWjhPb1EzejNHcEhWRDdfWmJEUQ?oc=5&hl=en-US&gl=US&ceid=US:en,,,,2026-04-09 20:28:52.330205,"""Ferrero"" ""GLP-1""",Ferrero,GLP-1,2026-04-09 20:28:52.330206
Ferrero to acquire majority stake in Spanish ice cream company ICFC - Global Food Industry News,Ferrero to acquire majority stake in Spanish ice cream company ICFC  Global Food Industry News,Ferrero to acquire majority stake in Spanish ice cream company ICFC  Global Food Industry News,https://news.google.com/rss/articles/CBMioAFBVV95cUxNbVhCMWZ4ZVVUMUc5UGVtb0ZjdGlmWXAxcUZGaVl2TXpMTmFUQUI0VjZzM25sOUNGUktKZzU1Y2QzY0NEbGdMamFvVmNuSlkwTnk3dGpZNE9lS19kd1ZyaUFUd09QQ0Q0UmhEOENiZGFYUkMyQ2pqMlZxM0lqaUZaUWl6dnNYZ3F1VFowRDNqZWI1X3hZQkwyRUpjZXBEWXBM?oc=5&hl=en-US&gl=US&ceid=US:en,,,,2026-04-09 20:28:52.330213,"""Ferrero"" ""GLP-1""",Ferrero,GLP-1,2026-04-09 20:28:52.330214
Ferrara Candy to buy Brazilian sweets maker Dori Alimentos - Global Food Industry News,Ferrara Candy to buy Brazilian sweets maker Dori Alimentos  Global Food Industry News,Ferrara Candy to buy Brazilian sweets maker Dori Alimentos  Global Food Industry News,https://news.google.com/rss/articles/CBMinwFBVV95cUxPYVB1RVVjQXl0Mk1SNFZhVElmM2NMa2U2S3A2cDRoYnhVajlOUDEzdmxEMjZNOHVOdFV0MDJVZ1RyS1VhR1ZPbnhIeS1kMWxOeDRpVUV1TTBfNDV6S3RTRFJfbVdNVWdaWmhsM0pjQTBhWmVmNlFBYVVSamRNTmd6aHpyb3dFVnYtaXNfSFNBQUZlNUpIbzFpb3pURTM5c28?oc=5&hl=en-US&gl=US&ceid=US:en,,,,2026-04-09 20:28:52.330220,"""Ferrero"" ""GLP-1""",Ferrero,GLP-1,2026-04-09 20:28:52.330221
Ferrero detects salmonella at Belgium plant at centre of 2022 outbreak and Kinder recall - Global Food Industry News,Ferrero detects salmonella at Belgium plant at centre of 2022 outbreak and Kinder recall  Global Food Industry News,Ferrero detects salmonella at Belgium plant at centre of 2022 outbreak and Kinder recall  Global Food Industry News,https://news.google.com/rss/articles/CBMivAFBVV95cUxNSzhaeVliUEhQa1dLN3g4VU9JVm5LbEJ3SzBKa3VDdV8xeF9GbXRwWjctbEo3U3Z6UXZkZmNMamtmMWRlVjN2Q1RZVWlNN1RQM0lVZ1NMdnctUXlkZGFxdjg0eTR5SXhHa3JsQzZVVExTdEdfdmhDd0tqdkdvNUQxdXVpUVNVTmNfR1Zka3FBUTJGUC1OUThGalNONHNZZHZZWm5RRkozQS03UzBvTExNbmZiZGZRMU1aSzZXYQ?oc=5&hl=en-US&gl=US&ceid=US:en,,,,2026-04-09 20:28:52.330228,"""Ferrero"" ""GLP-1""",Ferrero,GLP-1,2026-04-09 20:28:52.330229
Ferrero suspends Kinder operations at salmonella-hit plant in Belgium - Global Food Industry News,Ferrero suspends Kinder operations at salmonella-hit plant in Belgium  Global Food Industry News,Ferrero suspends Kinder operations at salmonella-hit plant in Belgium  Global Food Industry News,https://news.google.com/rss/articles/CBMikgFBVV95cUxNaVRuc3Q3LVJBRURGZkJTQVF3MjZZcFlPMzBxYVo3ZEdtcmpZb3BtYm4yVWs2eDZobHNRaXl5VWx4VHdHb29rQTd5ZWwyNWlseGdRZUtuV19ZVHkwaFhqZ1VaenozS01McVdIYm51WTBIY1hoX0ZSb2V4bEc1Y01zV2FZNnR0bjdNdzdvckxFRDRYUQ?oc=5&hl=en-US&gl=US&ceid=US:en,,,,2026-04-09 20:28:52.330235,"""Ferrero"" ""GLP-1""",Ferrero,GLP-1,2026-04-09 20:28:52.330237
Ferrero acquires US chocolate group Fannie May - Global Food Industry News,Ferrero acquires US chocolate group Fannie May  Global Food Industry News,Ferrero acquires US chocolate group Fannie May  Global Food Industry News,https://news.google.com/rss/articles/CBMihAFBVV95cUxOR25QM29OTVkxNi10dFZXbmVmLUJQWWNyMUtDcEctZkMtMGZoY0lNMkhNaFJCNTVSdHhRckt6TWRDNDFseGx6dnFoNkhaTW50V0lHNTM3V1pDSGZpU1gtdm95OTREWnNhYXRkZHg1MFRjRHNydWE1MWdLSkRFS0tNX1d4WkM?oc=5&hl=en-US&gl=US&ceid=US:en,,,,2026-04-09 20:28:52.330243,"""Ferrero"" ""GLP-1""",Ferrero,GLP-1,2026-04-09 20:28:52.330244
Ferrero to buy snack-bar factory in Germany - Global Food Industry News,Ferrero to buy snack-bar factory in Germany  Global Food Industry News,Ferrero to buy snack-bar factory in Germany  Global Food Industry News,https://news.google.com/rss/articles/CBMigAFBVV95cUxPOXRLUjNXSXJMd3NzSnhPZW9EWmZjVmVnYS1TblJyN0lFUGUyNXhqV01XMEgwbGFhVFVTNlU2ZmVscS1ZMFpmSzVlSHk2SmZNQVZOcllIOVVraDlKRTcyOFpFZk51LW11a3ozOGhFNkc4SXp5SjBQUFpSU2o5TXJ2Qw?oc=5&hl=en-US&gl=US&ceid=US:en,,,,2026-04-09 20:28:52.330252,"""Ferrero"" ""GLP-1""",Ferrero,GLP-1,2026-04-09 20:28:52.330253
Kinder recall: Ferrero raided as prosecutors launch salmonella probe - Global Food Industry News,Kinder recall: Ferrero raided as prosecutors launch salmonella probe  Global Food Industry News,Kinder recall: Ferrero raided as prosecutors launch salmonella probe  Global Food Industry News,https://news.google.com/rss/articles/CBMioAFBVV95cUxOMnFZVk5UcW9YUjRQZHFNeEk4Qk02U1NfdS1ES2EtNl80TjJrX182WVRCaC1WTi1FUXh6emN0WmN6a1EwYnVmakVTSjVVTHFncHc3STI3S3FtdjBfZWRzcGVUZFNES2hQR0U4Vy1lRG1QYmFhd3hkWXRkTk15RzI5VkVKdlVCVmp2dXBVNVd0V3NUSUVHYVh5eWJNcmpqRnlZ?oc=5&hl=en-US&gl=US&ceid=US:en,,,,2026-04-09 20:28:52.330259,"""Ferrero"" ""GLP-1""",Ferrero,GLP-1,2026-04-09 20:28:52.330261
Acquisitive Ferrero adds to snacks portfolio with Burton’s buy - Global Food Industry News,Acquisitive Ferrero adds to snacks portfolio with Burton’s buy  Global Food Industry News,Acquisitive Ferrero adds to snacks portfolio with Burton’s buy  Global Food Industry News,https://news.google.com/rss/articles/CBMickFVX3lxTFBpdzFwUzFCSDNKWGZSb0dCM2F1VU95WExJZm5tUXZ4WVM3QVF0Q2E1MTdLZDRFdFc3QjJuUFVLRXlKUm1Oa2pEZWRqZ3FqWkFnb1lyMzdhbGYwRWc5UWhsdHRKZXNGd0tXWkhRdGtJX0YwZw?oc=5&hl=en-US&gl=US&ceid=US:en,,,,2026-04-09 20:28:52.330266,"""Ferrero"" ""GLP-1""",Ferrero,GLP-1,2026-04-09 20:28:52.330268
Ferrero to further expand Canada plant - Global Food Industry News,Ferrero to further expand Canada plant  Global Food Industry News,Ferrero to further expand Canada plant  Global Food Industry News,https://news.google.com/rss/articles/CBMiekFVX3lxTFBwUlYxZ0x1Sk9WY2xQT092dVJHLW8zNFo5Q3ozVUVMMEVIWXJGdC1FaktNLVdPVDM2MGM3czVORU0yR0Rxc000MzY4X1F1bGNyVHdWa0RQTHI0NkJmSEFKSWVGek80VE1ETm9zdTJXRXlZa1ppWkxwU1VR?oc=5&hl=en-US&gl=US&ceid=US:en,,,,2026-04-09 20:28:52.330280,"""Ferrero"" ""GLP-1""",Ferrero,GLP-1,2026-04-09 20:28:52.330281
Ferrero to buy Irish protein-bar firm Fulfil Nutrition - Global Food Industry News,Ferrero to buy Irish protein-bar firm Fulfil Nutrition  Global Food Industry News,Ferrero to buy Irish protein-bar firm Fulfil Nutrition  Global Food Industry News,https://news.google.com/rss/articles/CBMijwFBVV95cUxORjVGSEFBa1JQcVNmSnJKRWVzTEhnQjNVOEIxNVN4eFJicFFkVGd0MU5TcnAwbUNvSEpoMUJGMW1RYWRtUktlaXJUenhsZ09wMlRwcWM3dDVMTGVkeWNKNXhyeEFhTHhldk00X005OUpza0xERFBRRXFEbUdPVnhBZTkzYUxjSm9YMjIwV3drdw?oc=5&hl=en-US&gl=US&ceid=US:en,,,,2026-04-09 20:28:52.330287,"""Ferrero"" ""GLP-1""",Ferrero,GLP-1,2026-04-09 20:28:52.330288
